[
  {
    "component": "action-group",
    "variant": "default",
    "slot": "root",
    "state": "default",
    "platformProperty": "border-color",
    "tokenRef": "dk.component.action-group-border.default.default",
    "fallbackRef": "dk.color.border.subtle.base"
  },
  {
    "component": "action-group",
    "variant": "default",
    "slot": "root",
    "state": "hover",
    "platformProperty": "border-color",
    "tokenRef": "dk.component.action-group-border.default.hover",
    "fallbackRef": "dk.color.accent.primary.base"
  },
  {
    "component": "action-group",
    "variant": "default",
    "slot": "root",
    "state": "active",
    "platformProperty": "border-color",
    "tokenRef": "dk.component.action-group-border.default.active",
    "fallbackRef": "dk.color.accent.primary.hover"
  },
  {
    "component": "action-group",
    "variant": "default",
    "slot": "root",
    "state": "disabled",
    "platformProperty": "border-color",
    "tokenRef": "dk.component.action-group-border.default.disabled",
    "fallbackRef": "dk.color.border.subtle.base"
  },
  {
    "component": "action-group",
    "variant": "default",
    "slot": "root",
    "state": "focus",
    "platformProperty": "border-color",
    "tokenRef": "dk.component.action-group-border.default.focus",
    "fallbackRef": "dk.color.border.focus.focus"
  },
  {
    "component": "action-group",
    "variant": "default",
    "slot": "container",
    "state": "default",
    "platformProperty": "background-color",
    "tokenRef": "dk.component.action-group-container.default.default",
    "fallbackRef": "dk.color.surface.default.base"
  },
  {
    "component": "action-group",
    "variant": "default",
    "slot": "container",
    "state": "hover",
    "platformProperty": "background-color",
    "tokenRef": "dk.component.action-group-container.default.hover",
    "fallbackRef": "dk.color.surface.raised.base"
  },
  {
    "component": "action-group",
    "variant": "default",
    "slot": "container",
    "state": "active",
    "platformProperty": "background-color",
    "tokenRef": "dk.component.action-group-container.default.active",
    "fallbackRef": "dk.color.accent.primary.base"
  },
  {
    "component": "action-group",
    "variant": "default",
    "slot": "container",
    "state": "disabled",
    "platformProperty": "background-color",
    "tokenRef": "dk.component.action-group-container.default.disabled",
    "fallbackRef": "dk.color.surface.default.base"
  },
  {
    "component": "action-group",
    "variant": "default",
    "slot": "item",
    "state": "default",
    "platformProperty": "background-color",
    "tokenRef": "dk.component.action-group-item.default.default",
    "fallbackRef": "dk.color.surface.default.base"
  },
  {
    "component": "action-group",
    "variant": "default",
    "slot": "item",
    "state": "hover",
    "platformProperty": "background-color",
    "tokenRef": "dk.component.action-group-item.default.hover",
    "fallbackRef": "dk.color.surface.raised.base"
  },
  {
    "component": "action-group",
    "variant": "default",
    "slot": "item",
    "state": "active",
    "platformProperty": "background-color",
    "tokenRef": "dk.component.action-group-item.default.active",
    "fallbackRef": "dk.color.accent.primary.base"
  },
  {
    "component": "action-group",
    "variant": "default",
    "slot": "item",
    "state": "disabled",
    "platformProperty": "background-color",
    "tokenRef": "dk.component.action-group-item.default.disabled",
    "fallbackRef": "dk.color.surface.default.base"
  },
  {
    "component": "action-group",
    "variant": "default",
    "slot": "label",
    "state": "default",
    "platformProperty": "color",
    "tokenRef": "dk.component.action-group-label.default.default",
    "fallbackRef": "dk.color.text.default.base"
  },
  {
    "component": "action-group",
    "variant": "default",
    "slot": "label",
    "state": "disabled",
    "platformProperty": "color",
    "tokenRef": "dk.component.action-group-label.default.disabled",
    "fallbackRef": "dk.color.text.muted.base"
  },
  {
    "component": "action-group",
    "variant": "default",
    "slot": "icon",
    "state": "default",
    "platformProperty": "color",
    "tokenRef": "dk.component.action-group-icon.default.default",
    "fallbackRef": "dk.color.text.default.base"
  },
  {
    "component": "action-group",
    "variant": "default",
    "slot": "icon",
    "state": "disabled",
    "platformProperty": "color",
    "tokenRef": "dk.component.action-group-icon.default.disabled",
    "fallbackRef": "dk.color.text.muted.base"
  },
  {
    "component": "action-group",
    "variant": "default",
    "slot": "root",
    "state": "focus",
    "platformProperty": "box-shadow",
    "tokenRef": "dk.component.action-group-shadow.default.focus",
    "fallbackRef": "dk.shadow.control.default.base"
  },
  {
    "component": "action-group",
    "variant": "default",
    "slot": "root",
    "state": "disabled",
    "platformProperty": "opacity",
    "tokenRef": "dk.component.action-group-opacity.default.disabled",
    "fallbackRef": "dk.opacity.disabled.default.base"
  },
  {
    "component": "action-group",
    "variant": "default",
    "slot": "root",
    "state": "default",
    "platformProperty": "transition-duration",
    "tokenRef": "dk.component.action-group-motion.default.default",
    "fallbackRef": "dk.motion.duration.control.base"
  }
]
