[
  {
    "component": "progress",
    "variant": "default",
    "slot": "root",
    "state": "default",
    "platformProperty": "border-color",
    "tokenRef": "dk.component.progress-border.default.default",
    "fallbackRef": "dk.color.border.subtle.base"
  },
  {
    "component": "progress",
    "variant": "default",
    "slot": "root",
    "state": "hover",
    "platformProperty": "border-color",
    "tokenRef": "dk.component.progress-border.default.hover",
    "fallbackRef": "dk.color.accent.primary.base"
  },
  {
    "component": "progress",
    "variant": "default",
    "slot": "root",
    "state": "active",
    "platformProperty": "border-color",
    "tokenRef": "dk.component.progress-border.default.active",
    "fallbackRef": "dk.color.accent.primary.hover"
  },
  {
    "component": "progress",
    "variant": "default",
    "slot": "root",
    "state": "disabled",
    "platformProperty": "border-color",
    "tokenRef": "dk.component.progress-border.default.disabled",
    "fallbackRef": "dk.color.border.subtle.base"
  },
  {
    "component": "progress",
    "variant": "default",
    "slot": "root",
    "state": "focus",
    "platformProperty": "border-color",
    "tokenRef": "dk.component.progress-border.default.focus",
    "fallbackRef": "dk.color.border.focus.focus"
  },
  {
    "component": "progress",
    "variant": "default",
    "slot": "track",
    "state": "default",
    "platformProperty": "background-color",
    "tokenRef": "dk.component.progress-track.default.default",
    "fallbackRef": "dk.color.surface.default.base"
  },
  {
    "component": "progress",
    "variant": "default",
    "slot": "track",
    "state": "hover",
    "platformProperty": "background-color",
    "tokenRef": "dk.component.progress-track.default.hover",
    "fallbackRef": "dk.color.surface.raised.base"
  },
  {
    "component": "progress",
    "variant": "default",
    "slot": "track",
    "state": "active",
    "platformProperty": "background-color",
    "tokenRef": "dk.component.progress-track.default.active",
    "fallbackRef": "dk.color.surface.raised.base"
  },
  {
    "component": "progress",
    "variant": "default",
    "slot": "track",
    "state": "disabled",
    "platformProperty": "background-color",
    "tokenRef": "dk.component.progress-track.default.disabled",
    "fallbackRef": "dk.color.surface.default.base"
  },
  {
    "component": "progress",
    "variant": "default",
    "slot": "fill",
    "state": "default",
    "platformProperty": "background-color",
    "tokenRef": "dk.component.progress-fill.default.default",
    "fallbackRef": "dk.color.accent.primary.base"
  },
  {
    "component": "progress",
    "variant": "default",
    "slot": "fill",
    "state": "hover",
    "platformProperty": "background-color",
    "tokenRef": "dk.component.progress-fill.default.hover",
    "fallbackRef": "dk.color.accent.primary.hover"
  },
  {
    "component": "progress",
    "variant": "default",
    "slot": "fill",
    "state": "active",
    "platformProperty": "background-color",
    "tokenRef": "dk.component.progress-fill.default.active",
    "fallbackRef": "dk.color.accent.primary.hover"
  },
  {
    "component": "progress",
    "variant": "default",
    "slot": "fill",
    "state": "disabled",
    "platformProperty": "background-color",
    "tokenRef": "dk.component.progress-fill.default.disabled",
    "fallbackRef": "dk.color.text.muted.base"
  },
  {
    "component": "progress",
    "variant": "default",
    "slot": "label",
    "state": "default",
    "platformProperty": "color",
    "tokenRef": "dk.component.progress-label.default.default",
    "fallbackRef": "dk.color.text.default.base"
  },
  {
    "component": "progress",
    "variant": "default",
    "slot": "label",
    "state": "disabled",
    "platformProperty": "color",
    "tokenRef": "dk.component.progress-label.default.disabled",
    "fallbackRef": "dk.color.text.muted.base"
  },
  {
    "component": "progress",
    "variant": "default",
    "slot": "root",
    "state": "focus",
    "platformProperty": "box-shadow",
    "tokenRef": "dk.component.progress-shadow.default.focus",
    "fallbackRef": "dk.shadow.control.default.base"
  },
  {
    "component": "progress",
    "variant": "default",
    "slot": "root",
    "state": "disabled",
    "platformProperty": "opacity",
    "tokenRef": "dk.component.progress-opacity.default.disabled",
    "fallbackRef": "dk.opacity.disabled.default.base"
  },
  {
    "component": "progress",
    "variant": "default",
    "slot": "root",
    "state": "default",
    "platformProperty": "transition-duration",
    "tokenRef": "dk.component.progress-motion.default.default",
    "fallbackRef": "dk.motion.duration.control.base"
  }
]
