[
  {
    "component": "button",
    "variant": "primary",
    "slot": "root",
    "state": "default",
    "platformProperty": "background-color",
    "tokenRef": "dk.component.button-bg.primary.default",
    "fallbackRef": "dk.color.accent.primary.base"
  },
  {
    "component": "button",
    "variant": "primary",
    "slot": "root",
    "state": "hover",
    "platformProperty": "background-color",
    "tokenRef": "dk.component.button-bg.primary.hover",
    "fallbackRef": "dk.color.accent.primary.hover"
  },
  {
    "component": "button",
    "variant": "primary",
    "slot": "root",
    "state": "active",
    "platformProperty": "background-color",
    "tokenRef": "dk.component.button-bg.primary.active",
    "fallbackRef": "dk.color.accent.primary.hover"
  },
  {
    "component": "button",
    "variant": "primary",
    "slot": "root",
    "state": "disabled",
    "platformProperty": "background-color",
    "tokenRef": "dk.component.button-bg.primary.disabled",
    "fallbackRef": "dk.color.accent.primary.base"
  },
  {
    "component": "button",
    "variant": "primary",
    "slot": "label",
    "state": "default",
    "platformProperty": "color",
    "tokenRef": "dk.component.button-label.primary.default",
    "fallbackRef": "dk.color.text.default.base"
  },
  {
    "component": "button",
    "variant": "primary",
    "slot": "label",
    "state": "disabled",
    "platformProperty": "color",
    "tokenRef": "dk.component.button-label.primary.disabled",
    "fallbackRef": "dk.color.text.muted.base"
  },
  {
    "component": "button",
    "variant": "primary",
    "slot": "root",
    "state": "focus",
    "platformProperty": "border-color",
    "tokenRef": "dk.component.button-border.primary.focus",
    "fallbackRef": "dk.color.border.focus.focus"
  },
  {
    "component": "button",
    "variant": "primary",
    "slot": "root",
    "state": "focus",
    "platformProperty": "box-shadow",
    "tokenRef": "dk.component.button-shadow.primary.focus",
    "fallbackRef": "dk.shadow.control.default.base"
  },
  {
    "component": "button",
    "variant": "primary",
    "slot": "root",
    "state": "disabled",
    "platformProperty": "opacity",
    "tokenRef": "dk.component.button-opacity.primary.disabled",
    "fallbackRef": "dk.opacity.disabled.default.base"
  },
  {
    "component": "button",
    "variant": "primary",
    "slot": "root",
    "state": "default",
    "platformProperty": "transition-duration",
    "tokenRef": "dk.component.button-motion.primary.default",
    "fallbackRef": "dk.motion.duration.control.base"
  }
]

