[
  {
    "component": "accordion",
    "variant": "default",
    "slot": "root",
    "state": "default",
    "platformProperty": "border-color",
    "tokenRef": "dk.component.accordion-border.default.default",
    "fallbackRef": "dk.color.border.subtle.base"
  },
  {
    "component": "accordion",
    "variant": "default",
    "slot": "root",
    "state": "hover",
    "platformProperty": "border-color",
    "tokenRef": "dk.component.accordion-border.default.hover",
    "fallbackRef": "dk.color.accent.primary.base"
  },
  {
    "component": "accordion",
    "variant": "default",
    "slot": "root",
    "state": "active",
    "platformProperty": "border-color",
    "tokenRef": "dk.component.accordion-border.default.active",
    "fallbackRef": "dk.color.accent.primary.hover"
  },
  {
    "component": "accordion",
    "variant": "default",
    "slot": "root",
    "state": "disabled",
    "platformProperty": "border-color",
    "tokenRef": "dk.component.accordion-border.default.disabled",
    "fallbackRef": "dk.color.border.subtle.base"
  },
  {
    "component": "accordion",
    "variant": "default",
    "slot": "root",
    "state": "focus",
    "platformProperty": "border-color",
    "tokenRef": "dk.component.accordion-border.default.focus",
    "fallbackRef": "dk.color.border.focus.focus"
  },
  {
    "component": "accordion",
    "variant": "default",
    "slot": "item",
    "state": "default",
    "platformProperty": "background-color",
    "tokenRef": "dk.component.accordion-item.default.default",
    "fallbackRef": "dk.color.surface.default.base"
  },
  {
    "component": "accordion",
    "variant": "default",
    "slot": "item",
    "state": "hover",
    "platformProperty": "background-color",
    "tokenRef": "dk.component.accordion-item.default.hover",
    "fallbackRef": "dk.color.surface.raised.base"
  },
  {
    "component": "accordion",
    "variant": "default",
    "slot": "item",
    "state": "active",
    "platformProperty": "background-color",
    "tokenRef": "dk.component.accordion-item.default.active",
    "fallbackRef": "dk.color.surface.raised.base"
  },
  {
    "component": "accordion",
    "variant": "default",
    "slot": "item",
    "state": "disabled",
    "platformProperty": "background-color",
    "tokenRef": "dk.component.accordion-item.default.disabled",
    "fallbackRef": "dk.color.surface.default.base"
  },
  {
    "component": "accordion",
    "variant": "default",
    "slot": "header",
    "state": "default",
    "platformProperty": "color",
    "tokenRef": "dk.component.accordion-header.default.default",
    "fallbackRef": "dk.color.text.default.base"
  },
  {
    "component": "accordion",
    "variant": "default",
    "slot": "header",
    "state": "disabled",
    "platformProperty": "color",
    "tokenRef": "dk.component.accordion-header.default.disabled",
    "fallbackRef": "dk.color.text.muted.base"
  },
  {
    "component": "accordion",
    "variant": "default",
    "slot": "body",
    "state": "default",
    "platformProperty": "color",
    "tokenRef": "dk.component.accordion-body.default.default",
    "fallbackRef": "dk.color.text.default.base"
  },
  {
    "component": "accordion",
    "variant": "default",
    "slot": "body",
    "state": "disabled",
    "platformProperty": "color",
    "tokenRef": "dk.component.accordion-body.default.disabled",
    "fallbackRef": "dk.color.text.muted.base"
  },
  {
    "component": "accordion",
    "variant": "default",
    "slot": "icon",
    "state": "default",
    "platformProperty": "color",
    "tokenRef": "dk.component.accordion-icon.default.default",
    "fallbackRef": "dk.color.text.default.base"
  },
  {
    "component": "accordion",
    "variant": "default",
    "slot": "icon",
    "state": "disabled",
    "platformProperty": "color",
    "tokenRef": "dk.component.accordion-icon.default.disabled",
    "fallbackRef": "dk.color.text.muted.base"
  },
  {
    "component": "accordion",
    "variant": "default",
    "slot": "root",
    "state": "focus",
    "platformProperty": "box-shadow",
    "tokenRef": "dk.component.accordion-shadow.default.focus",
    "fallbackRef": "dk.shadow.control.default.base"
  },
  {
    "component": "accordion",
    "variant": "default",
    "slot": "root",
    "state": "disabled",
    "platformProperty": "opacity",
    "tokenRef": "dk.component.accordion-opacity.default.disabled",
    "fallbackRef": "dk.opacity.disabled.default.base"
  },
  {
    "component": "accordion",
    "variant": "default",
    "slot": "root",
    "state": "default",
    "platformProperty": "transition-duration",
    "tokenRef": "dk.component.accordion-motion.default.default",
    "fallbackRef": "dk.motion.duration.control.base"
  }
]
