[
  {
    "component": "list",
    "variant": "default",
    "slot": "root",
    "state": "default",
    "platformProperty": "border-color",
    "tokenRef": "dk.component.list-border.default.default",
    "fallbackRef": "dk.color.border.subtle.base"
  },
  {
    "component": "list",
    "variant": "default",
    "slot": "root",
    "state": "hover",
    "platformProperty": "border-color",
    "tokenRef": "dk.component.list-border.default.hover",
    "fallbackRef": "dk.color.accent.primary.base"
  },
  {
    "component": "list",
    "variant": "default",
    "slot": "root",
    "state": "active",
    "platformProperty": "border-color",
    "tokenRef": "dk.component.list-border.default.active",
    "fallbackRef": "dk.color.accent.primary.hover"
  },
  {
    "component": "list",
    "variant": "default",
    "slot": "root",
    "state": "disabled",
    "platformProperty": "border-color",
    "tokenRef": "dk.component.list-border.default.disabled",
    "fallbackRef": "dk.color.border.subtle.base"
  },
  {
    "component": "list",
    "variant": "default",
    "slot": "root",
    "state": "focus",
    "platformProperty": "border-color",
    "tokenRef": "dk.component.list-border.default.focus",
    "fallbackRef": "dk.color.border.focus.focus"
  },
  {
    "component": "list",
    "variant": "default",
    "slot": "item",
    "state": "default",
    "platformProperty": "background-color",
    "tokenRef": "dk.component.list-item.default.default",
    "fallbackRef": "dk.color.surface.default.base"
  },
  {
    "component": "list",
    "variant": "default",
    "slot": "item",
    "state": "hover",
    "platformProperty": "background-color",
    "tokenRef": "dk.component.list-item.default.hover",
    "fallbackRef": "dk.color.surface.raised.base"
  },
  {
    "component": "list",
    "variant": "default",
    "slot": "item",
    "state": "active",
    "platformProperty": "background-color",
    "tokenRef": "dk.component.list-item.default.active",
    "fallbackRef": "dk.color.surface.raised.base"
  },
  {
    "component": "list",
    "variant": "default",
    "slot": "item",
    "state": "disabled",
    "platformProperty": "background-color",
    "tokenRef": "dk.component.list-item.default.disabled",
    "fallbackRef": "dk.color.surface.default.base"
  },
  {
    "component": "list",
    "variant": "default",
    "slot": "label",
    "state": "default",
    "platformProperty": "color",
    "tokenRef": "dk.component.list-label.default.default",
    "fallbackRef": "dk.color.text.default.base"
  },
  {
    "component": "list",
    "variant": "default",
    "slot": "label",
    "state": "disabled",
    "platformProperty": "color",
    "tokenRef": "dk.component.list-label.default.disabled",
    "fallbackRef": "dk.color.text.muted.base"
  },
  {
    "component": "list",
    "variant": "default",
    "slot": "marker",
    "state": "default",
    "platformProperty": "color",
    "tokenRef": "dk.component.list-marker.default.default",
    "fallbackRef": "dk.color.accent.primary.base"
  },
  {
    "component": "list",
    "variant": "default",
    "slot": "marker",
    "state": "disabled",
    "platformProperty": "color",
    "tokenRef": "dk.component.list-marker.default.disabled",
    "fallbackRef": "dk.color.text.muted.base"
  },
  {
    "component": "list",
    "variant": "default",
    "slot": "root",
    "state": "focus",
    "platformProperty": "box-shadow",
    "tokenRef": "dk.component.list-shadow.default.focus",
    "fallbackRef": "dk.shadow.control.default.base"
  },
  {
    "component": "list",
    "variant": "default",
    "slot": "root",
    "state": "disabled",
    "platformProperty": "opacity",
    "tokenRef": "dk.component.list-opacity.default.disabled",
    "fallbackRef": "dk.opacity.disabled.default.base"
  },
  {
    "component": "list",
    "variant": "default",
    "slot": "root",
    "state": "default",
    "platformProperty": "transition-duration",
    "tokenRef": "dk.component.list-motion.default.default",
    "fallbackRef": "dk.motion.duration.control.base"
  }
]
