[
  {
    "component": "file-upload",
    "variant": "default",
    "slot": "root",
    "state": "default",
    "platformProperty": "border-color",
    "tokenRef": "dk.component.file-upload-border.default.default",
    "fallbackRef": "dk.color.border.subtle.base"
  },
  {
    "component": "file-upload",
    "variant": "default",
    "slot": "root",
    "state": "hover",
    "platformProperty": "border-color",
    "tokenRef": "dk.component.file-upload-border.default.hover",
    "fallbackRef": "dk.color.accent.primary.base"
  },
  {
    "component": "file-upload",
    "variant": "default",
    "slot": "root",
    "state": "active",
    "platformProperty": "border-color",
    "tokenRef": "dk.component.file-upload-border.default.active",
    "fallbackRef": "dk.color.accent.primary.hover"
  },
  {
    "component": "file-upload",
    "variant": "default",
    "slot": "root",
    "state": "disabled",
    "platformProperty": "border-color",
    "tokenRef": "dk.component.file-upload-border.default.disabled",
    "fallbackRef": "dk.color.border.subtle.base"
  },
  {
    "component": "file-upload",
    "variant": "default",
    "slot": "root",
    "state": "focus",
    "platformProperty": "border-color",
    "tokenRef": "dk.component.file-upload-border.default.focus",
    "fallbackRef": "dk.color.border.focus.focus"
  },
  {
    "component": "file-upload",
    "variant": "default",
    "slot": "dropzone",
    "state": "default",
    "platformProperty": "background-color",
    "tokenRef": "dk.component.file-upload-dropzone.default.default",
    "fallbackRef": "dk.color.surface.default.base"
  },
  {
    "component": "file-upload",
    "variant": "default",
    "slot": "dropzone",
    "state": "hover",
    "platformProperty": "background-color",
    "tokenRef": "dk.component.file-upload-dropzone.default.hover",
    "fallbackRef": "dk.color.surface.raised.base"
  },
  {
    "component": "file-upload",
    "variant": "default",
    "slot": "dropzone",
    "state": "active",
    "platformProperty": "background-color",
    "tokenRef": "dk.component.file-upload-dropzone.default.active",
    "fallbackRef": "dk.color.surface.raised.base"
  },
  {
    "component": "file-upload",
    "variant": "default",
    "slot": "dropzone",
    "state": "disabled",
    "platformProperty": "background-color",
    "tokenRef": "dk.component.file-upload-dropzone.default.disabled",
    "fallbackRef": "dk.color.surface.default.base"
  },
  {
    "component": "file-upload",
    "variant": "default",
    "slot": "label",
    "state": "default",
    "platformProperty": "color",
    "tokenRef": "dk.component.file-upload-label.default.default",
    "fallbackRef": "dk.color.text.default.base"
  },
  {
    "component": "file-upload",
    "variant": "default",
    "slot": "label",
    "state": "disabled",
    "platformProperty": "color",
    "tokenRef": "dk.component.file-upload-label.default.disabled",
    "fallbackRef": "dk.color.text.muted.base"
  },
  {
    "component": "file-upload",
    "variant": "default",
    "slot": "helper",
    "state": "default",
    "platformProperty": "color",
    "tokenRef": "dk.component.file-upload-helper.default.default",
    "fallbackRef": "dk.color.text.muted.base"
  },
  {
    "component": "file-upload",
    "variant": "default",
    "slot": "helper",
    "state": "disabled",
    "platformProperty": "color",
    "tokenRef": "dk.component.file-upload-helper.default.disabled",
    "fallbackRef": "dk.color.text.muted.base"
  },
  {
    "component": "file-upload",
    "variant": "default",
    "slot": "icon",
    "state": "default",
    "platformProperty": "color",
    "tokenRef": "dk.component.file-upload-icon.default.default",
    "fallbackRef": "dk.color.accent.primary.base"
  },
  {
    "component": "file-upload",
    "variant": "default",
    "slot": "icon",
    "state": "disabled",
    "platformProperty": "color",
    "tokenRef": "dk.component.file-upload-icon.default.disabled",
    "fallbackRef": "dk.color.text.muted.base"
  },
  {
    "component": "file-upload",
    "variant": "default",
    "slot": "root",
    "state": "focus",
    "platformProperty": "box-shadow",
    "tokenRef": "dk.component.file-upload-shadow.default.focus",
    "fallbackRef": "dk.shadow.control.default.base"
  },
  {
    "component": "file-upload",
    "variant": "default",
    "slot": "root",
    "state": "disabled",
    "platformProperty": "opacity",
    "tokenRef": "dk.component.file-upload-opacity.default.disabled",
    "fallbackRef": "dk.opacity.disabled.default.base"
  },
  {
    "component": "file-upload",
    "variant": "default",
    "slot": "root",
    "state": "default",
    "platformProperty": "transition-duration",
    "tokenRef": "dk.component.file-upload-motion.default.default",
    "fallbackRef": "dk.motion.duration.control.base"
  }
]
